{
  "$schema": "https://json-schema.org/draft/2020-12/schema",
  "$id": "https://github.com/intrale/platform/.pipeline/agent-models.schema.json",
  "title": "agent-models.json — schema multi-proveedor del pipeline V3 (#3081 + #3065 + #3077)",
  "description": "Schema canónico para .pipeline/agent-models.json. Source-of-truth del enum de 'launcher' y 'output_parser' es lib/agent-models-validate.js — el validador inyecta los enums programáticamente al cargar el schema (composición), evitando drift schema↔código. La cross-validación de quota_error_types contra la meta-allowlist por provider vive en lib/quota-exhausted.js (KNOWN_QUOTA_ERROR_TYPES_BY_PROVIDER) — #3077 SEC-2 (defensa anti-supply-chain). #3613 (bootstrap del skill `architect`): la sección `skills` usa `additionalProperties: { $ref: skillAssignment }` sin allowlist explícita de nombres, por lo que el agregado del skill `architect` no requiere cambio funcional al schema. Este `_doc` se actualiza primero (commit aparte) para auditar el orden inquebrantable schema → JSON (SEC-2 #3081). #6562 (criterio de admisión de proveedores): `providerDef.admission` declara las tres condiciones de admisión (CLI que edita archivos, consumo verificable, términos sin entrenamiento) o la exención explícita `non_llm` para ejecutores sin LLM. El schema sólo tipa el bloque; el guardrail fail-closed (campo ausente = no cumple, mensaje que nombra la condición incumplida) vive en validateProviderAdmission (lib/agent-models-validate.js). Orden inquebrantable schema → JSON.",
  "type": "object",
  "required": ["default_provider", "providers", "skills"],
  "additionalProperties": false,
  "properties": {
    "$schema": {
      "type": "string",
      "description": "Ref al schema. Conveniencia para IDEs."
    },
    "_doc": {
      "type": "string",
      "description": "Puntero a la documentación canónica (docs/pipeline-multi-provider.md §3.1) para que el operador encuentre rápido el contexto al editar este archivo."
    },
    "default_provider": {
      "type": "string",
      "description": "Provider por default cuando un skill no tiene override. DEBE existir en la sección 'providers' (validación cruzada en lib/agent-models-validate.js).",
      "minLength": 1
    },
    "providers": {
      "type": "object",
      "description": "Definición de cada provider disponible. Llave = nombre interno del provider (ej. 'anthropic', 'openai-codex', 'deterministic').",
      "minProperties": 1,
      "additionalProperties": { "$ref": "#/$defs/providerDef" }
    },
    "skills": {
      "type": "object",
      "description": "Asignación skill → provider. Llave = nombre del skill (ej. 'backend-dev', 'qa', 'builder').",
      "minProperties": 1,
      "additionalProperties": { "$ref": "#/$defs/skillAssignment" }
    }
  },

  "$defs": {

    "providerDef": {
      "type": "object",
      "required": [
        "launcher",
        "model",
        "spawn_args_template",
        "output_parser",
        "quota_error_types",
        "supports_tool_use",
        "prompt_caching"
      ],
      "additionalProperties": false,
      "properties": {
        "launcher": {
          "type": "string",
          "description": "Alias del launcher. DEBE estar dentro de ALLOWED_LAUNCHERS (lib/agent-models-validate.js). El enum se inyecta programáticamente al cargar el schema; el literal abajo es informativo (post #3220 + #3243 + #3353; plantel reducido a tres proveedores LLM en #6563).",
          "enum": ["claude", "codex", "gemini-google", "node"]
        },
        "model": {
          "type": "string",
          "description": "Modelo default del provider. Puede ser sobrescrito por skill via 'model_override'.",
          "minLength": 1
        },
        "spawn_args_template": {
          "type": "array",
          "description": "Plantilla de argv para el spawn. Las claves entre llaves ({user_prompt}, {system_file}, {script_path}, {issue}, {trabajando_path}) son sustituidas por la engine de spawn al lanzar el agente. La sustitución es 1:1 a un elemento del argv (NUNCA concatenación con shell). Set permitido: ALLOWED_PLACEHOLDERS en lib/agent-models-validate.js. Denylist de flags: DENIED_FLAGS.",
          "items": { "type": "string" },
          "minItems": 1
        },
        "output_parser": {
          "type": "string",
          "description": "Parser que normaliza el output del CLI al shape común. 'none' para providers determinísticos sin LLM. Enum inyectado programáticamente desde ALLOWED_OUTPUT_PARSERS.",
          "enum": ["anthropic-stream-json", "openai-sse", "gemini-stream", "none"]
        },
        "quota_error_types": {
          "type": "array",
          "description": "Lista de strings que marca el detector de cuota (lib/quota-exhausted.js) como 'cuota agotada' para este provider. Vacío si el provider no tiene cuota. Cada item se cross-valida contra la meta-allowlist por provider (KNOWN_QUOTA_ERROR_TYPES_BY_PROVIDER en lib/quota-exhausted.js) — #3077 SEC-2 (defensa anti-supply-chain).",
          "items": { "type": "string", "minLength": 1 }
        },
        "resets_at_cap_max_days": {
          "type": "integer",
          "description": "Cap superior (en días) para el campo 'resets_at' cuando el provider reporta cuota agotada. Default 7 (cuota semanal Plan Max Anthropic). OpenAI suele usar cuotas mensuales — declarar 31. Aplicado en capResetsAt() para evitar 'falso drenado natural' cuando un evento legítimo declara un reset_at lejano. #3077 SEC-6.",
          "minimum": 1,
          "maximum": 366
        },
        "supports_tool_use": {
          "description": "Soporte de tool use / function calling. true = paridad funcional con Anthropic; 'limited' = soporte parcial con traducción; false = sin soporte.",
          "oneOf": [
            { "type": "boolean" },
            { "type": "string", "enum": ["limited"] }
          ]
        },
        "prompt_caching": {
          "type": "object",
          "description": "Capacidades de prompt caching. Necesario para normalizar costos cross-provider.",
          "required": ["supported"],
          "additionalProperties": false,
          "properties": {
            "supported": { "type": "boolean" },
            "auto": {
              "type": "boolean",
              "description": "Si true, el provider cachea automáticamente sin que el cliente especifique. OpenAI cumple; Anthropic NO (requiere cache_control)."
            },
            "ttl_seconds_default": {
              "type": "integer",
              "description": "TTL default del cache en segundos. Anthropic = 300.",
              "minimum": 1
            },
            "ttl_seconds_extended": {
              "type": "integer",
              "description": "TTL extendido (si el provider lo soporta). Anthropic = 3600.",
              "minimum": 1
            }
          }
        },
        "credentials_env": {
          "type": "array",
          "description": "Lista de env vars que deben existir al boot del pulpo si este provider está referenciado por algún skill.",
          "items": { "type": "string", "minLength": 1 }
        },
        "permissions_mode": {
          "type": "string",
          "description": "Modo de permisos del CLI. Mapeado en la tabla §6.7 del doc multi-provider.",
          "minLength": 1
        },
        "auth_mode": {
          "type": "string",
          "description": "Cómo se autentica el provider. 'oauth' = login interactivo (Claude Max), no usa API key configurada acá. 'api_key' = key gestionada en credentials.json. Default 'api_key' si está ausente. #3361 — permite distinguir Anthropic (OAuth Max) sin hardcodear nombres en el frontend.",
          "enum": ["oauth", "api_key"]
        },
        "display_in_health": {
          "type": "string",
          "description": "Cómo se exhibe este provider en la ventana Providers del dashboard. 'live' = se pingea y se muestra el semáforo en vivo. 'not_applicable' = se muestra como 'NO APLICA' (badge informativo, sin semáforo). Default 'live'. #3361 — separa la visualización de la lista canónica para que listConfiguredProviders() siga siendo la fuente de verdad única.",
          "enum": ["live", "not_applicable"]
        },
        "alternative_models": {
          "type": "array",
          "description": "Modelos alternativos del mismo provider que Sherlock puede usar para preservar adversariality parcial cuando el Commander y Sherlock coinciden en provider (#3501). Lista ordenada por preferencia. Si `commanderProvider === sherlockProvider` y `commanderModel === sherlockModel`, el resolver itera estos modelos antes de saltar al siguiente provider de la chain. Cada entry se cross-valida contra `ALLOWED_MODELS_BY_LAUNCHER` en lib/agent-models-validate.js (defensa anti-supply-chain CA-SEC-SWAP-1). Caps `maxItems: 3` + `uniqueItems: true` evitan cost-amplification (CA-SEC-SWAP-2). Ausencia o lista vacía → política inactiva para este provider, comportamiento idéntico al actual (CA-4 default-safe).",
          "items": { "type": "string", "minLength": 1 },
          "maxItems": 3,
          "uniqueItems": true
        },
        "capabilities": {
          "type": "array",
          "description": "#4839 — Capabilities de EJECUCIÓN que el motor del provider declara sostener (eje CAPACIDAD DEL MOTOR, NO el eje autorización de lib/capabilities.js). El enum de valores válidos se inyecta programáticamente desde EXECUTION_CAPABILITY_CATALOG (lib/execution-capabilities.js) al cargar el schema — el literal abajo es informativo. Opcional: la AUSENCIA de `capabilities` se trata FAIL-CLOSED como 'no ofrece ninguna' en el matching de fallbacks (validateCrossReferences), nunca 'asumir capaz' (SEC-3). Enum cerrado + uniqueItems para que no se pueda inyectar una capability arbitraria que evada el matching (SEC-2).",
          "items": { "type": "string", "enum": ["agentic-tool-use"] },
          "uniqueItems": true
        },
        "billing": {
          "type": "string",
          "description": "#4870 — Clasificación de facturación del provider: 'paid' (Anthropic, OpenAI-Codex) o 'free' (Gemini; Cerebras y NVIDIA NIM retirados en #6563). Fuente única de verdad de '¿hay pago disponible?' para el modo reducido (isReducedMode en lib/commander/multi-provider.js). Opcional (retrocompat): la AUSENCIA de `billing` se trata FAIL-SAFE como 'free' en todo lookup del código — un provider sin marcar NUNCA se confunde con pago. Los providers determinísticos/canned (sin LLM tarifado) quedan sin `billing`. Enum cerrado para que no se pueda inyectar un tier arbitrario.",
          "enum": ["paid", "free"]
        },
        "admission": {
          "type": "object",
          "description": "#6562 — Declaración de las tres condiciones de admisión al ruteo. Un provider entra al ruteo (default_provider / skills.*.provider / fallbacks[]) sólo si declara las tres en true. FAIL-CLOSED: un campo ausente vale 'no declaró' (no cumple) y el mensaje del guardrail lo distingue de 'declaró false'. 'non_llm: true' exime a los ejecutores sin LLM (deterministic) — sólo válido con output_parser 'none' (cross-check en lib/agent-models-validate.js). 'exception' permite mantener en el ruteo, con motivo y vencimiento, un provider que hoy no cumple (p. ej. baja programada en #6563): vencida la fecha vuelve a ser error de carga. Vocabulario alineado con docs/pipeline/multi-provider.md §16.",
          "additionalProperties": false,
          "properties": {
            "non_llm": {
              "type": "boolean",
              "description": "true = ejecutor sin LLM (launcher node, output_parser none). Las tres condiciones no aplican. Exención explícita y visible en la declaración, nunca un caso especial escondido en el código."
            },
            "cli_edits_files": {
              "type": "boolean",
              "description": "Condición 1 — CLI local capaz de editar archivos del repo (no una API pelada de chat). Debe ser coherente con capabilities ['agentic-tool-use']: declarar true sin esa capability es error de carga."
            },
            "reports_usage": {
              "type": "boolean",
              "description": "Condición 2 — reporta consumo verificable del período (cuánto se lleva gastado), no sólo 'te pasaste'. Sin esto no hay contabilidad posible."
            },
            "terms_no_training": {
              "type": "boolean",
              "description": "Condición 3 — términos de servicio que no entrenan con nuestro código (política vigente, ver docs/pipeline-multi-provider/data-residency.md)."
            },
            "exception": {
              "type": "object",
              "description": "Excepción temporal al criterio: mantiene en el ruteo a un provider que no cumple, con motivo y fecha de vencimiento (YYYY-MM-DD, UTC, inclusive). Vencida ⇒ error de carga. Cap de vigencia en ADMISSION_EXCEPTION_MAX_DAYS (lib/agent-models-validate.js).",
              "required": ["reason", "until"],
              "additionalProperties": false,
              "properties": {
                "reason": { "type": "string", "minLength": 1, "description": "Por qué sigue en el ruteo pese a no cumplir (p. ej. 'baja programada en #6563')." },
                "until": { "type": "string", "pattern": "^\\d{4}-\\d{2}-\\d{2}$", "description": "Último día de vigencia (UTC, inclusive)." },
                "issue": { "type": "integer", "minimum": 1, "description": "Issue que resuelve la excepción (trazabilidad)." }
              }
            }
          }
        }
      }
    },

    "skillAssignment": {
      "type": "object",
      "required": ["provider"],
      "additionalProperties": false,
      "properties": {
        "provider": {
          "type": "string",
          "description": "Provider asignado al skill. DEBE existir en la sección 'providers' (validación cruzada en lib/agent-models-validate.js).",
          "minLength": 1
        },
        "model_override": {
          "type": "string",
          "description": "Modelo específico que sobrescribe el 'model' default del provider. La cross-validación contra la allowlist de modelos por launcher (ALLOWED_MODELS_BY_LAUNCHER) se hace en lib/agent-models-validate.js durante el boot.",
          "minLength": 1
        },
        "fallbacks": {
          "type": "array",
          "description": "Lista ordenada de providers fallback para este skill. Si el provider primario falla (cuota / 5xx / circuit-breaker), el pulpo intenta con el siguiente. Cada item DEBE existir en 'providers'. Validación cruzada en lib/agent-models-validate.js. Vacío o ausente = usar solo el provider primario. Issue #3177 (UI dashboard) + apertura para H7/M2. Issue #3221 (multi-provider per-agent order): cada item puede ser (a) un string con el nombre del provider (legacy, usa el `model` default del provider) o (b) un objeto `{provider, model_override}` que pin-ea el modelo del provider para este skill — necesario para el orden sign-off 2026-05-15 donde, por ejemplo, qa quiere `gpt-5` (vision) en lugar del `gpt-5-codex` default de openai-codex.",
          "items": { "$ref": "#/$defs/fallbackEntry" }
        },
        "interactive_supported": {
          "type": "boolean",
          "description": "Issue #3605: opt-in para habilitar chat operador↔agente vía stdin pipe. Si true, agent-launcher abre stdio[0]='pipe' (en vez de 'ignore' default), pulpo registra el child en lib/agent-ipc y el endpoint /api/agent-chat acepta mensajes para este skill. Default false preserva el invariante I3 del agent-launcher (regresión cero CA-4). Solo válido para providers que soportan input incremental por stdin (anthropic CLI sí; gemini-google HTTP no). El endpoint responde 412 Precondition Failed si el cliente intenta usar este flag con un provider que no lo soporta. NO documentar en agent-models.json sin coordinar con docs/pipeline/multi-provider.md."
        },
        "required_capabilities": {
          "type": "array",
          "description": "#4839 — Capabilities de EJECUCIÓN que el rol EXIGE a su provider primario y a cada fallback. El enum de valores válidos se inyecta programáticamente desde EXECUTION_CAPABILITY_CATALOG (lib/execution-capabilities.js) al cargar el schema — el literal abajo es informativo. Opcional: ausente o `[]` ⇒ rol sin exigencia (habilita providers de razonamiento/texto sin agentic-tool-use, ej. review/po). Los roles agénticos (dev *, qa, tester, build) declaran ['agentic-tool-use']: el validador rechaza FAIL-CLOSED cualquier provider (primario o fallback) que no declare la capability requerida (validateCrossReferences). Enum cerrado + uniqueItems (SEC-2).",
          "items": { "type": "string", "enum": ["agentic-tool-use"] },
          "uniqueItems": true
        },
        "balancing": {
          "type": "object",
          "description": "Issue #4412 (Parte 2/3 de #4363): balanceo ponderado de providers del Commander detrás de feature flag. SOLO pondera providers ya declarados en 'fallbacks[]' (+ el primario) — NUNCA expande la superficie de lanzamiento (req A01 / SEC-1, defensas #3080/#3081/#3085; ALLOWED_LAUNCHERS sigue siendo la fuente única en lib/agent-models-validate.js). Schema cerrado (additionalProperties:false) para que config malformada/inyectada no introduzca claves arbitrarias ni valores fuera de rango que desvíen el ruteo (SEC-2). Con 'enabled:false' (default) el dispatch es idéntico al orden estricto actual (regresión cero, CA-7).",
          "additionalProperties": false,
          "required": ["enabled"],
          "properties": {
            "enabled": {
              "type": "boolean",
              "description": "Feature flag maestro. Default false (regresión cero): el Commander cae a la cadena estricta de resolveSpawnWithFallback. Con true, el selector ponderado (lib/commander/provider-balancer.js) reparte los requests entre los providers sanos de 'fallbacks[]'."
            },
            "quality_bias": {
              "type": "number",
              "minimum": 0,
              "maximum": 1,
              "description": "Sesgo hacia el orden de calidad canónico (Claude > Codex > Gemini; Cerebras retirado en #6563). A mayor valor, más concentra el primario. Acotado [0,1]."
            },
            "min_primary_quota_pct": {
              "type": "integer",
              "minimum": 0,
              "maximum": 100,
              "description": "Umbral de cuota disponible por debajo del cual el peso del provider se degrada y el reparto se corre hacia los siguientes en orden de calidad. Entero [0,100]."
            }
          }
        }
      }
    },

    "fallbackEntry": {
      "description": "Item de fallbacks[]. Backward-compatible: acepta string (legacy, solo provider name) o object {provider, model_override}. La cross-validation contra ALLOWED_MODELS_BY_LAUNCHER + providers[] vive en lib/agent-models-validate.js.",
      "oneOf": [
        {
          "type": "string",
          "minLength": 1
        },
        {
          "type": "object",
          "required": ["provider"],
          "additionalProperties": false,
          "properties": {
            "provider": {
              "type": "string",
              "description": "Nombre del provider fallback. DEBE existir en 'providers'.",
              "minLength": 1
            },
            "model_override": {
              "type": "string",
              "description": "Modelo específico del provider fallback para este skill. La cross-validación contra ALLOWED_MODELS_BY_LAUNCHER se hace en lib/agent-models-validate.js durante el boot.",
              "minLength": 1
            }
          }
        }
      ]
    }
  }
}
