{
  "$schema": "./agent-models.schema.json",
  "_doc": "Configuración multi-proveedor del pipeline V3 — issue #3072 (H1) + #3077 (H5) + #3221 (sign-off Leo 2026-05-15 por agente) + #3258 (skill virtual `telegram-commander`). Documento canónico: docs/pipeline/multi-provider.md. Para agregar/cambiar un provider, primero editar agent-models.schema.json (allowlist de launcher/model) y después este archivo. El boot del pulpo valida con Ajv 2020-12 y aborta si no matchea — ver lib/agent-models-validate.js (#3081 S3). Los strings de 'quota_error_types' se cross-validan contra la meta-allowlist hardcoded en lib/quota-exhausted.js (KNOWN_QUOTA_ERROR_TYPES_BY_PROVIDER) — agregar un valor fuera de esa meta-allowlist hace boot fail-fast (SEC-2 de #3077). Los `fallbacks[]` por skill respetan el orden sign-off Leo 2026-05-15 (memoria project_multi-provider-per-agent-order); los skills con Gemini EXCLUIDO quedan fuera por credenciales e integridad de main (TOS Antigravity consumer; auditoría #6860 del 2026-09-16, ver §4.4.1). El skill virtual `telegram-commander` (#3258) NO está en `skills_por_fase` — es consumido por pulpo.js (commander chat de Telegram) vía lib/commander/multi-provider.js para el dispatch con fallback chain. Reorden 2026-06-02 (sign-off Leo por voz): (A) devs (backend/pipeline/android/web) + security sacan Cerebras del fallback y meten nvidia-nim — Cerebras no soporta tool_use y no puede editar archivos; NVIDIA es free + tool_use. (B) default global de chain = Claude → Codex → Gemini → Cerebras (Cerebras queda como tail solo en skills de chat/verificación que no requieren tool_use). Corrección de runtime: el modelo Cerebras pasa de `llama-3.3-70b` (muerto, no está en free tier) a `gpt-oss-120b` (verificado GET /v1/models + smoke #3794); alternative_models → `zai-glm-4.7`. telegram-commander suma nvidia-nim al final para alinear el JSON con el código de #3796. Reorden de modelos 2026-06-02 (sign-off Leo por voz): telegram-commander baja su primario de claude-opus-4-7 → claude-sonnet-4-7 y su fallback Codex de gpt-5-codex → gpt-5 (es el cerebro, conserva calidad pero ahorra ~5x vs Opus sin pérdida relevante en chat/operación). telegram-sherlock MANTIENE claude-haiku-4-5 como primario (es el piso de calidad del verificador y NO se baja — un verificador flojo aprueba cualquier cosa) y baja solo su fallback Codex de gpt-5 → gpt-5-mini (verificación no necesita el tope). gpt-5-mini se agregó a ALLOWED_MODELS_BY_LAUNCHER.codex en lib/agent-models-validate.js. Reorden Grupo B 2026-06-02 (sign-off Leo por voz): qa/po/ux bajan de claude-opus-4-7 → claude-sonnet-4-7 (no escriben código de producción — evalúan, validan video por frames+capturas y redactan criterios; la capacidad de visión de Sonnet es la misma que Opus, ahorro ~5x sin pérdida relevante). refinar tenía un bug de config: solo declaraba `provider:anthropic` sin model_override → heredaba el default claude-opus-4-7 y SIN fallbacks; ahora explicita claude-sonnet-4-7 + fallbacks [codex gpt-5, cerebras gpt-oss-120b]. Grupo A (backend/pipeline/android/web-dev + security) MANTIENE claude-opus-4-7 — su output va a main y un dev flojo genera rebotes que cuestan más que el ahorro. CORRECCIÓN DE NOMBRES DE MODELOS 2026-06-04 (sign-off Leo por voz, verificado en vivo contra cada CLI/API): los nombres configurados arriba estaban desactualizados y rotos. (1) `claude-sonnet-4-7` NO existe en el catálogo Anthropic → reemplazado por `claude-sonnet-4-6` (13 refs). (2) Codex con cuenta ChatGPT rechaza `gpt-5-codex`/`gpt-5`/`gpt-5-mini` con 400 ('not supported when using Codex with a ChatGPT account'); catálogo real = gpt-5.5 (frontier, strongest agentic coding), gpt-5.4, gpt-5.4-mini → mapeo preservando tiering: skills de código (gpt-5-codex) → gpt-5.5, eval/chat (gpt-5) → gpt-5.4, verificador Sherlock (gpt-5-mini) → gpt-5.4-mini; el `model` default del provider openai-codex pasa a gpt-5.5. (3) `gemini-1.5-flash` (alternative_models) fue retirado de Google → `gemini-2.5-flash`. Cerebras (gpt-oss-120b, zai-glm-4.7) verificado vigente, sin cambios; el modelo NVIDIA de entonces quedó desactualizado y fue re-verificado y migrado el 2026-08-13 (ver la entrada de #5887 al final de este doc). La allowlist ALLOWED_MODELS_BY_LAUNCHER en lib/agent-models-validate.js se actualizó en sincronía. claude-opus-4-7 se mantiene (vigente y funcional; existe claude-opus-4-8 más nuevo pero el cambio queda fuera de alcance por ser decisión de costo/calidad, no un fix). Migración NVIDIA 2026-08-13 (#5887, parte 1 del split de #5698): el modelo que tenía configurado el provider nvidia-nim llegó a end-of-life el 2026-08-07T09:00:00Z y devolvía HTTP 410 en toda invocación, matando sin trabajo a cualquier agente que cayera a NVIDIA en su cadena de fallback. Sucesor: deepseek-ai/deepseek-v4-flash-0731, aplicado al `model` del provider y a los 6 `model_override` (android-dev, web-dev, security, guru, telegram-commander, telegram-sherlock). Verificación en vivo del 2026-08-13 contra integrate.api.nvidia.com, en la misma pasada de implementación: (a) GET /v1/models devolvió HTTP 200 con deepseek-ai/deepseek-v4-flash-0731 presente en el catálogo (102 modelos) y el id anterior ausente; (b) POST /v1/chat/completions con tools[] devolvió HTTP 200 con finish_reason=tool_calls y tool_calls[0].function.name=read_file — tool_use medido en vivo, no heredado de la capability declarada del provider. Pin con sufijo de fecha (-0731), nunca alias flotante. Las tres barreras de modelo (ALLOWED_MODELS_BY_LAUNCHER en lib/agent-models-validate.js, PROVIDER_MODELS_ALLOWLIST en lib/multi-provider/completion-client.js y DEFAULT_MODEL en lib/agent-launcher/runners/nvidia-nim-runner.js) se actualizaron por reemplazo en el mismo commit: el id viejo se quitó, no sólo se agregó el nuevo, para que ninguna reintroducción futura pase silenciosa. Resolución de modelo por actor 2026-08-20 (#6271, split de #6270): hasta este cambio resolve-provider.js leía el modelo del skill desde el campo `model`, que NO existe en este schema — el campo canónico es `model_override`. El efecto era que los 23 skills declarados resolvían de manera uniforme el literal legacy claude-opus-4-7, ignorando su model_override. Ahora el mapeo es (skill, provider) con precedencia: model_override del eslabón que corre (skillCfg para el primario, fallbacks[i] para cada respaldo) -> providers.<X>.model -> models.defaults.model -> terminal. `model` se acepta sólo como alias de compatibilidad. Nota sobre models.defaults: esa clave NO existe en este archivo y nunca existió; el escalón se conserva por compatibilidad pero el default efectivo es providers.<X>.model, que sí está declarado para los 7 providers. IDENTIFICADORES CANÓNICOS del commander y del verificador de Telegram: las claves de `skills` son `telegram-commander` y `telegram-sherlock`, NO `commander` ni `sherlock` a secas. Esos son los strings que usa el código (lib/commander/multi-provider.js: COMMANDER_SKILL y SHERLOCK_SKILL). Sondear el resolvedor con los nombres cortos devuelve source=fallback-skill-not-found y el default de anthropic — es el comportamiento esperado para un skill inexistente, no un defecto de esta configuración. NO agregar entradas `commander`/`sherlock`: crearían claves duplicadas y divergentes frente a las canónicas, que es peor que el estado actual. CRITERIO DE ADMISIÓN DE PROVEEDORES 2026-09-16 (#6562, programa Contabilidad y balanceo de cuota por proveedor): cada provider declara en `admission` las tres condiciones de entrada al ruteo — `cli_edits_files` (CLI local capaz de editar archivos), `reports_usage` (reporta consumo verificable del período) y `terms_no_training` (términos que no entrenan con nuestro código) — o la exención explícita `non_llm: true` (sólo `deterministic`, output_parser none). El guardrail (validateProviderAdmission en lib/agent-models-validate.js) es fail-closed: un provider referenciado por default_provider / skills.*.provider / fallbacks[] que no declare las tres en true rompe la carga con un mensaje que nombra la condición incumplida y distingue 'declaró false' de 'no declaró'. Evaluación registrada al 2026-09-16: anthropic y openai-codex admisibles (tres en true); gemini-google (edita, no reporta consumo, TOS free entrena), nvidia-nim (edita, reporte no implementado, términos sin verificar), cerebras (no edita, no reporta, términos sin verificar) y kimi-moonshot (no edita, sin adapter, términos sin verificar) NO admisibles y siguen en las cadenas sólo por `admission.exception` con vencimiento 2026-10-31 e issue #6563 (la baja efectiva es alcance de #6563; vencida la fecha, el boot vuelve a rechazar). Las condiciones sin verificación documentada se declaran false por fail-closed, nunca true por omisión. Tabla completa y justificación en docs/pipeline/multi-provider.md §16. Migración del catálogo Antigravity 2026-09-16 (#6858, split de #6856): `gemini-3-flash-preview` era el id del Gemini CLI gratuito (retirado) y NO existe en Antigravity (`agy models`, CLI 1.2.4) — con el provider encendido todo spawn hubiera muerto sin trabajo con `--model` inválido, mismo modo de falla que #5887. Reemplazo por ids explícitos del catálogo real: `providers.gemini-google.model` → `gemini-3.8-flash-medium`; devs y architect (android-dev, web-dev, architect) → `gemini-3.8-flash-high`; evaluadores/chat (qa, po, ux, perf, telegram-commander) → `gemini-3.8-flash-medium`; verificador telegram-sherlock → `gemini-3.8-flash-low` (mismo tiering que Anthropic sonnet→haiku y Codex 5.4→5.4-mini). `alternative_models` → `gemini-3.7-flash-medium` (familia DISTINTA al primario para que Sherlock conserve adversarialidad parcial, #3501; `gemini-2.5-flash` tampoco está en el catálogo). La asignación fina modelo↔agente es de #6860. CANAL DE ESFUERZO: el sufijo del id (`-high/-medium/-low`) es el ÚNICO canal; nunca se pasa `--effort` además, así el string de la traza es exactamente el que corrió. Las tres barreras (ALLOWED_MODELS_BY_LAUNCHER, PROVIDER_MODELS_ALLOWLIST, CATALOG de model-catalog